{
  "receipt_id": "emet-verify-0123456789abcdef",
  "verdict": "MATCH",
  "witness": {
    "implementation": "emet-python-reference",
    "spec_version": "0.2.0-draft",
    "self_sha256": "1111111111111111111111111111111111111111111111111111111111111111",
    "check": "verify"
  },
  "subject": [
    {
      "name": "example.txt",
      "digest": { "sha256": "2222222222222222222222222222222222222222222222222222222222222222" }
    }
  ],
  "evidence": {
    "exit_code": 0,
    "stdout_verdict_line": "MATCH example.txt"
  },
  "notes": "EMET emits witness facts only; the receipt carries no authority, permission, or release decision."
}
